{
  "schema_version": "1.0",
  "fixture_id": "dev-decline",
  "periods": {
    "previous": {
      "start": "2026-09-14",
      "end": "2026-09-20"
    },
    "current": {
      "start": "2026-09-21",
      "end": "2026-09-27"
    }
  },
  "summary": "Weekly analytics for period 2026-09-21 to 2026-09-27 relative to 2026-09-14 to 2026-09-20 show notable declines across organic search acquisition and on-site activity under complete 7-day data coverage. In Search Console, clicks decreased by -30.032573% and click-through rate (CTR) dropped by -25.035075%, alongside a worsening average search position from 5.753 to 7.053 (+22.596906%). In PostHog, sessions decreased by -20.0%, active users by -18.598131%, and conversions by -19.672131%, while conversion rate remained relatively unchanged (+0.409834%). Search Console clicks and PostHog sessions measure distinct user populations and cannot be equated. Because aggregate weekly counts do not reveal root causes, further investigation into specific queries, landing pages, and conversion funnels is recommended.",
  "sources": {
    "search_console": {
      "completeness": {
        "previous": {
          "expected_days": 7,
          "observed_days": 7,
          "reason": null
        },
        "current": {
          "expected_days": 7,
          "observed_days": 7,
          "reason": null
        }
      },
      "kpis": {
        "clicks": {
          "previous": 1535,
          "current": 1074,
          "absolute_change": -461,
          "wow_pct": -30.032573,
          "status": "ok",
          "unit": "count",
          "evidence_refs": [
            "search_console.clicks.previous",
            "search_console.clicks.current",
            "search_console.clicks.absolute_change",
            "search_console.clicks.wow_pct"
          ]
        },
        "impressions": {
          "previous": 30691,
          "current": 28645,
          "absolute_change": -2046,
          "wow_pct": -6.666449,
          "status": "ok",
          "unit": "count",
          "evidence_refs": [
            "search_console.impressions.previous",
            "search_console.impressions.current",
            "search_console.impressions.absolute_change",
            "search_console.impressions.wow_pct"
          ]
        },
        "position": {
          "previous": 5.753,
          "current": 7.053,
          "absolute_change": 1.3,
          "wow_pct": 22.596906,
          "status": "ok",
          "unit": "position",
          "evidence_refs": [
            "search_console.position.previous",
            "search_console.position.current",
            "search_console.position.absolute_change",
            "search_console.position.wow_pct"
          ]
        },
        "ctr": {
          "previous": 0.050014662,
          "current": 0.037493454,
          "absolute_change": -0.012521,
          "wow_pct": -25.035075,
          "status": "ok",
          "unit": "ratio",
          "evidence_refs": [
            "search_console.ctr.previous",
            "search_console.ctr.current",
            "search_console.ctr.absolute_change",
            "search_console.ctr.wow_pct"
          ]
        }
      }
    },
    "posthog": {
      "completeness": {
        "previous": {
          "expected_days": 7,
          "observed_days": 7,
          "reason": null
        },
        "current": {
          "expected_days": 7,
          "observed_days": 7,
          "reason": null
        }
      },
      "kpis": {
        "sessions": {
          "previous": 2445,
          "current": 1956,
          "absolute_change": -489,
          "wow_pct": -20.0,
          "status": "ok",
          "unit": "count",
          "evidence_refs": [
            "posthog.sessions.previous",
            "posthog.sessions.current",
            "posthog.sessions.absolute_change",
            "posthog.sessions.wow_pct"
          ]
        },
        "users": {
          "previous": 2140,
          "current": 1742,
          "absolute_change": -398,
          "wow_pct": -18.598131,
          "status": "ok",
          "unit": "count",
          "evidence_refs": [
            "posthog.users.previous",
            "posthog.users.current",
            "posthog.users.absolute_change",
            "posthog.users.wow_pct"
          ]
        },
        "conversions": {
          "previous": 122,
          "current": 98,
          "absolute_change": -24,
          "wow_pct": -19.672131,
          "status": "ok",
          "unit": "count",
          "evidence_refs": [
            "posthog.conversions.previous",
            "posthog.conversions.current",
            "posthog.conversions.absolute_change",
            "posthog.conversions.wow_pct"
          ]
        },
        "conversion_rate": {
          "previous": 0.049897751,
          "current": 0.050102249,
          "absolute_change": 0.000204,
          "wow_pct": 0.409834,
          "status": "ok",
          "unit": "ratio",
          "evidence_refs": [
            "posthog.conversion_rate.previous",
            "posthog.conversion_rate.current",
            "posthog.conversion_rate.absolute_change",
            "posthog.conversion_rate.wow_pct"
          ]
        }
      }
    }
  },
  "findings": [
    {
      "id": "finding-sc-clicks",
      "kind": "change",
      "source": "search_console",
      "metric": "clicks",
      "statement": "Search Console clicks decreased by -30.032573% week-over-week, changing by -461 from 1535 to 1074.",
      "evidence_refs": [
        "search_console.clicks.previous",
        "search_console.clicks.current",
        "search_console.clicks.absolute_change",
        "search_console.clicks.wow_pct"
      ],
      "claims": [
        {
          "ref": "search_console.clicks.previous",
          "value": 1535
        },
        {
          "ref": "search_console.clicks.current",
          "value": 1074
        },
        {
          "ref": "search_console.clicks.absolute_change",
          "value": -461
        },
        {
          "ref": "search_console.clicks.wow_pct",
          "value": -30.032573
        }
      ]
    },
    {
      "id": "finding-sc-ctr",
      "kind": "change",
      "source": "search_console",
      "metric": "ctr",
      "statement": "Search Console click-through rate (CTR) decreased by -25.035075% week-over-week, changing by -0.012521 from 0.050014662 to 0.037493454.",
      "evidence_refs": [
        "search_console.ctr.previous",
        "search_console.ctr.current",
        "search_console.ctr.absolute_change",
        "search_console.ctr.wow_pct"
      ],
      "claims": [
        {
          "ref": "search_console.ctr.previous",
          "value": 0.050014662
        },
        {
          "ref": "search_console.ctr.current",
          "value": 0.037493454
        },
        {
          "ref": "search_console.ctr.absolute_change",
          "value": -0.012521
        },
        {
          "ref": "search_console.ctr.wow_pct",
          "value": -25.035075
        }
      ]
    },
    {
      "id": "finding-ph-sessions",
      "kind": "change",
      "source": "posthog",
      "metric": "sessions",
      "statement": "PostHog sessions decreased by -20.0% week-over-week, changing by -489 from 2445 to 1956.",
      "evidence_refs": [
        "posthog.sessions.previous",
        "posthog.sessions.current",
        "posthog.sessions.absolute_change",
        "posthog.sessions.wow_pct"
      ],
      "claims": [
        {
          "ref": "posthog.sessions.previous",
          "value": 2445
        },
        {
          "ref": "posthog.sessions.current",
          "value": 1956
        },
        {
          "ref": "posthog.sessions.absolute_change",
          "value": -489
        },
        {
          "ref": "posthog.sessions.wow_pct",
          "value": -20.0
        }
      ]
    }
  ],
  "limitations": [
    {
      "code": "synthetic_data",
      "source": null,
      "detail": "This report is generated from synthetic evaluation data and does not represent live customer or [REDACTED] metrics."
    },
    {
      "code": "source_distinction",
      "source": null,
      "detail": "Search Console clicks and PostHog sessions measure different populations and cannot be substituted, added, or directly equated."
    }
  ],
  "next_checks": [
    "Segment Search Console queries and pages to identify specific search terms and URLs driving the decrease in clicks and CTR and the increase in average position.",
    "Segment PostHog traffic by referrer, channel, and landing page to identify which visitor cohorts or acquisition channels drove the decrease in sessions and active users.",
    "Analyze PostHog conversion funnels and key event flows to determine whether the conversion drop is concentrated in specific flows while aggregate conversion rate remained stable.",
    "Audit technical site health, indexing status, and recent deployments during 2026-09-21 to 2026-09-27 for any crawler or tracking anomalies."
  ]
}